<!ELEMENT bookstore (book+)>
<!ELEMENT book (title, author, genre, price, publish_date, description)>
<!ELEMENT title (#PCDATA)>
<!ELEMENT author (#PCDATA)>
<!ELEMENT genre (#PCDATA)>
<!ELEMENT price (#PCDATA)>
<!ELEMENT publish_date (#PCDATA)>
<!ELEMENT description (#PCDATA)>
